{"$schema":"urn:docwen:schema:numbering-export-plan:v1","schema":"docwen.numbering_export_plan.v1","input_id":"document-1","source_sha256":"1111111111111111111111111111111111111111111111111111111111111111","plan_sha256":"2222222222222222222222222222222222222222222222222222222222222222","plan":{"heading_definitions":[],"heading_instances":[],"targets":[{"source_start":0,"source_end":1,"kind":"heading","enabled":false,"target_id":"1-source-id","derived_number":null,"materialization":null}]}}
