{"$schema":"urn:docwen:schema:numbering-export-plan:v1","schema":"docwen.numbering_export_plan.v1","input_id":"fixture-d4c0c6535675a6e035ca119679068d3f","source_sha256":"d4c0c6535675a6e035ca119679068d3f7dc35f58a4f983b5245d6d82addea316","plan_sha256":"8afec2632746106f04180c85d61296fc4a64e594ef4bf0f54fa0725192ed2355","plan":{"heading_definitions":[{"definition_id":"heading-default","levels":[{"display":[{"counter":{"level":1,"number_format":"arabic_half"}}],"level":1,"number_format":"arabic_half","restart_after_level":null,"start":1,"suffix":"space"}]}],"heading_instances":[{"definition_id":"heading-default","instance_id":"heading-instance-1","starts":[]}],"targets":[{"derived_number":"1","enabled":true,"kind":"heading","materialization":{"definition_id":"heading-default","instance_id":"heading-instance-1","level":1,"type":"heading_list"},"source_end":22,"source_start":0,"target_id":"h-7f3a"},{"derived_number":"1","enabled":true,"kind":"figure","materialization":{"chapter_cached_number":null,"chapter_heading_level":null,"chapter_heading_style":null,"chapter_separator":null,"counter":"Figure","label_separator":" ","localized_label":"Figure","number_format":"arabic_half","restart_heading_level":null,"restart_heading_style":null,"sequence_action":"continue","sequence_cached_number":"1","start_value":null,"type":"simple_seq"},"source_end":64,"source_start":24,"target_id":"system-overview"},{"derived_number":"1","enabled":true,"kind":"table","materialization":{"chapter_cached_number":null,"chapter_heading_level":null,"chapter_heading_style":null,"chapter_separator":null,"counter":"Table","label_separator":" ","localized_label":"Table","number_format":"arabic_half","restart_heading_level":null,"restart_heading_style":null,"sequence_action":"continue","sequence_cached_number":"1","start_value":null,"type":"simple_seq"},"source_end":112,"source_start":84,"target_id":"results-main"},{"derived_number":"1","enabled":true,"kind":"equation","materialization":{"chapter_cached_number":null,"chapter_heading_level":null,"chapter_heading_style":null,"chapter_separator":null,"counter":"Equation","label_separator":" ","localized_label":"Equation","number_format":"arabic_half","restart_heading_level":null,"restart_heading_style":null,"sequence_action":"continue","sequence_cached_number":"1","start_value":null,"type":"simple_seq"},"source_end":182,"source_start":160,"target_id":"energy-main"},{"derived_number":"1","enabled":true,"kind":"code_block","materialization":{"chapter_cached_number":null,"chapter_heading_level":null,"chapter_heading_style":null,"chapter_separator":null,"counter":"Code","label_separator":" ","localized_label":"Code","number_format":"arabic_half","restart_heading_level":null,"restart_heading_style":null,"sequence_action":"continue","sequence_cached_number":"1","start_value":null,"type":"simple_seq"},"source_end":230,"source_start":201,"target_id":"entry-main"}]}}